{
  "schema": "line-routes.v1",
  "feed_hash": "a50a630bc92f9de3119e96480d2f7881e782fb88f1571452e52ab85eb23a2497",
  "line": "22",
  "routes": [
    {
      "id": "20000221110",
      "name": "Terminal Alvorada - Terminal Jardim Oceânico",
      "agency": "MOBI-Rio",
      "type": 702
    }
  ],
  "patterns": [
    {
      "id": "346d9e7e55796f64e058eb912e3a7afa2f4b11be58afa683575b60861fc38427",
      "route": "20000221110",
      "direction": "0",
      "shape": "n7of",
      "headsign": "Terminal Jardim Oceânico",
      "stops": [
        "bam4",
        "4128BO0011U1",
        "4128BO0013U1",
        "4128BO0016U1",
        "4128BO0018U1",
        "4128BO0019P1"
      ],
      "trips": 2
    },
    {
      "id": "455532d95ef29e0a14480b20d57886f183eecf8dc26f020d796fff84c541bc59",
      "route": "20000221110",
      "direction": "1",
      "shape": "hj1m",
      "headsign": "Terminal Alvorada",
      "stops": [
        "4128BO0019P2",
        "4128BO0018U2",
        "4128BO0017U2",
        "4128BO0016U2",
        "4128BO0015U2",
        "4128BO0014U2",
        "4128BO0176U2",
        "4128BO0011U2",
        "bam4"
      ],
      "trips": 2
    },
    {
      "id": "96f343ef2500dfd443a209f2a04a9f3cf3860964548ddd3f7bb9e5049faa32be",
      "route": "20000221110",
      "direction": "0",
      "shape": "ivlc",
      "headsign": "Terminal Jardim Oceânico",
      "stops": [
        "bam4",
        "4128BO0011U1",
        "4128BO0013U1",
        "4128BO0014U1",
        "4128BO0015U1",
        "4128BO0016U1",
        "4128BO0017U1",
        "4128BO0018U1",
        "4128BO0019P1"
      ],
      "trips": 4
    },
    {
      "id": "f36283a06b04cda4847cf25f85c8e48606cd68623afa48961bf4b74876d75b83",
      "route": "20000221110",
      "direction": "1",
      "shape": "csy6",
      "headsign": "Terminal Alvorada",
      "stops": [
        "4128BO0019P2",
        "4128BO0018U2",
        "4128BO0016U2",
        "4128BO0176U2",
        "4128BO0011U2",
        "bam4"
      ],
      "trips": 4
    }
  ],
  "shapes": [
    {
      "id": "csy6",
      "path": [
        [
          -43.31258,
          -23.0066
        ],
        [
          -43.31258,
          -23.00658
        ],
        [
          -43.31362,
          -23.00649
        ],
        [
          -43.31473,
          -23.00652
        ],
        [
          -43.31568,
          -23.00648
        ],
        [
          -43.31595,
          -23.00645
        ],
        [
          -43.31626,
          -23.00637
        ],
        [
          -43.316257,
          -23.006371
        ],
        [
          -43.31626,
          -23.00637
        ],
        [
          -43.3172,
          -23.00612
        ],
        [
          -43.31766,
          -23.0059
        ],
        [
          -43.31805,
          -23.00572
        ],
        [
          -43.31852,
          -23.00546
        ],
        [
          -43.321094,
          -23.004413
        ],
        [
          -43.3211,
          -23.00441
        ],
        [
          -43.32121,
          -23.00437
        ],
        [
          -43.32153,
          -23.00425
        ],
        [
          -43.323412,
          -23.003443
        ],
        [
          -43.32342,
          -23.00344
        ],
        [
          -43.32361,
          -23.00336
        ],
        [
          -43.32368,
          -23.00336
        ],
        [
          -43.3239,
          -23.00327
        ],
        [
          -43.3239,
          -23.00326
        ],
        [
          -43.32417,
          -23.00315
        ],
        [
          -43.32417,
          -23.00315
        ],
        [
          -43.32476,
          -23.00292
        ],
        [
          -43.324762,
          -23.002919
        ],
        [
          -43.32476,
          -23.00292
        ],
        [
          -43.32637,
          -23.00227
        ],
        [
          -43.326367,
          -23.002271
        ],
        [
          -43.32637,
          -23.00227
        ],
        [
          -43.32775,
          -23.00171
        ],
        [
          -43.327751,
          -23.00171
        ],
        [
          -43.32881,
          -23.00128
        ],
        [
          -43.32887,
          -23.00128
        ],
        [
          -43.32906,
          -23.00124
        ],
        [
          -43.32905,
          -23.00122
        ],
        [
          -43.329495,
          -23.001052
        ],
        [
          -43.3295,
          -23.00105
        ],
        [
          -43.3297,
          -23.00099
        ],
        [
          -43.33057,
          -23.00081
        ],
        [
          -43.331296,
          -23.00073
        ],
        [
          -43.3313,
          -23.00073
        ],
        [
          -43.333174,
          -23.00061
        ],
        [
          -43.33318,
          -23.00061
        ],
        [
          -43.33485,
          -23.0005
        ],
        [
          -43.33491,
          -23.00051
        ],
        [
          -43.33515,
          -23.00052
        ],
        [
          -43.33515,
          -23.0005
        ],
        [
          -43.33543,
          -23.00048
        ],
        [
          -43.335489,
          -23.00046
        ],
        [
          -43.33549,
          -23.00046
        ],
        [
          -43.335867,
          -23.00043
        ],
        [
          -43.33587,
          -23.00043
        ],
        [
          -43.33756,
          -23.00033
        ],
        [
          -43.337557,
          -23.00033
        ],
        [
          -43.33756,
          -23.00033
        ],
        [
          -43.33863,
          -23.00027
        ],
        [
          -43.339097,
          -23.00024
        ],
        [
          -43.3391,
          -23.00024
        ],
        [
          -43.340088,
          -23.00021
        ],
        [
          -43.34009,
          -23.00021
        ],
        [
          -43.340764,
          -23.0002
        ],
        [
          -43.34077,
          -23.0002
        ],
        [
          -43.34174,
          -23.00018
        ],
        [
          -43.34179,
          -23.0002
        ],
        [
          -43.34202,
          -23.00021
        ],
        [
          -43.34202,
          -23.0002
        ],
        [
          -43.34226,
          -23.00019
        ],
        [
          -43.34233,
          -23.00017
        ],
        [
          -43.342491,
          -23.00017
        ],
        [
          -43.3425,
          -23.00017
        ],
        [
          -43.34404,
          -23.00014
        ],
        [
          -43.344037,
          -23.00014
        ],
        [
          -43.34404,
          -23.00014
        ],
        [
          -43.345619,
          -23.00011
        ],
        [
          -43.34562,
          -23.00011
        ],
        [
          -43.34626,
          -23.00009
        ],
        [
          -43.34632,
          -23.00011
        ],
        [
          -43.34654,
          -23.00011
        ],
        [
          -43.34676,
          -23.00011
        ],
        [
          -43.346845,
          -23.000091
        ],
        [
          -43.34685,
          -23.00009
        ],
        [
          -43.34729,
          -23.00008
        ],
        [
          -43.3473,
          -23.00008
        ],
        [
          -43.34845,
          -23.00005
        ],
        [
          -43.348449,
          -23.00005
        ],
        [
          -43.34845,
          -23.00005
        ],
        [
          -43.350873,
          -23.00001
        ],
        [
          -43.35088,
          -23.00001
        ],
        [
          -43.35206,
          -22.99999
        ],
        [
          -43.35219,
          -23.00001
        ],
        [
          -43.352481,
          -23.000013
        ],
        [
          -43.35249,
          -23
        ],
        [
          -43.352814,
          -22.99998
        ],
        [
          -43.35282,
          -22.99998
        ],
        [
          -43.353464,
          -22.99997
        ],
        [
          -43.35347,
          -22.99997
        ],
        [
          -43.35421,
          -22.99996
        ],
        [
          -43.354205,
          -22.99996
        ],
        [
          -43.35421,
          -22.99996
        ],
        [
          -43.354479,
          -22.99995
        ],
        [
          -43.354918,
          -22.99995
        ],
        [
          -43.35492,
          -22.99995
        ],
        [
          -43.355059,
          -22.99994
        ],
        [
          -43.35506,
          -22.99994
        ],
        [
          -43.355237,
          -22.999939
        ],
        [
          -43.3593,
          -22.99987
        ],
        [
          -43.36038,
          -22.99986
        ],
        [
          -43.36096,
          -22.99988
        ],
        [
          -43.36104,
          -22.99991
        ],
        [
          -43.361308,
          -22.99993
        ],
        [
          -43.36131,
          -22.99993
        ],
        [
          -43.36156,
          -22.99994
        ],
        [
          -43.36162,
          -22.99992
        ],
        [
          -43.362189,
          -22.999959
        ],
        [
          -43.3622,
          -22.99996
        ],
        [
          -43.36282,
          -22.99999
        ],
        [
          -43.36376,
          -23
        ],
        [
          -43.3653,
          -23.00006
        ],
        [
          -43.36674,
          -23.00011
        ],
        [
          -43.36686,
          -23.00018
        ],
        [
          -43.36691,
          -23.00028
        ],
        [
          -43.3669,
          -23.00054
        ],
        [
          -43.366944,
          -23.000619
        ],
        [
          -43.36695,
          -23.00063
        ],
        [
          -43.36701,
          -23.0007
        ],
        [
          -43.36701,